word,definition
unutterably,"You can use unutterable to emphasize that something, especially a bad quality, is great in degree or intensity."
vacuous,having or showing a lack of thought or intelligence; mindless
vague,"of uncertain, indefinite, or unclear character or meaning"
vaguely,"in a way that is uncertain, indefinite or unclear; "
vast,of very great extent or quantity; immense.
vestibule,"an antechamber, hall, or lobby next to the outer door of a building"
villainous,"relating to, constituting, or guilty of wicked or criminal behavior."
violent,"using or involving physical force intended to hurt, damage, or kill someone or something."
violently,in a very strong or vigorous manner
violently,"using physical force intended to hurt, damage, or kill someone or something"
vulgar,"lacking in cultivation, perception, or taste "
vulgar,indecent; obscene; lewd:
weird,"of strange or extraordinary character : odd, fantastic"
wonder,a cause of astonishment or admiration
wonderful,"inspiring delight, pleasure, or admiration; extremely good; marvelous"